input,output,input_processed,is_divorce,topic_label,announce_date,text_combined
혼인관계가 파탄에 이른 시점을 어떻게 판단하나요?,"혼인관계가 파탄에 이른 시점은 여러 사정을 종합적으로 고려하여 판단됩니다. 예를 들어, 배우자가 지속적으로 이혼을 요구하며 자살 시도를 하거나 가출하는 등의 심각한 사태가 발생한 경우, 그리고 배우자가 이혼 소송에서 반소 제기 등의 구체적인 행위를 한 시점 등을 종합적으로 고려합니다.",혼인 관계 파탄 이르다 시점 하나요,1,4,2019-01-23T09:00:00.000+09:00,"혼인관계가 파탄에 이른 시점을 어떻게 판단하나요? 혼인관계가 파탄에 이른 시점은 여러 사정을 종합적으로 고려하여 판단됩니다. 예를 들어, 배우자가 지속적으로 이혼을 요구하며 자살 시도를 하거나 가출하는 등의 심각한 사태가 발생한 경우, 그리고 배우자가 이혼 소송에서 반소 제기 등의 구체적인 행위를 한 시점 등을 종합적으로 고려합니다."
불법행위로 인한 위자료 청구의 요건은 무엇인가요?,"불법행위로 인한 위자료 청구를 위해서는 피해가 발생해야 하며, 그 피해가 가해자의 고의 또는 과실에 의해 발생해야 합니다. 이와 관련하여, 대법원 판례에 따르면 부정행위가 혼인의 본질인 부부 공동생활을 침해하거나 그 유지를 방해하는 경우에는 위자료 청구가 인정됩니다.",불법행위 위자료 청구,1,8,2021-09-29T09:00:00.000+09:00,"불법행위로 인한 위자료 청구의 요건은 무엇인가요? 불법행위로 인한 위자료 청구를 위해서는 피해가 발생해야 하며, 그 피해가 가해자의 고의 또는 과실에 의해 발생해야 합니다. 이와 관련하여, 대법원 판례에 따르면 부정행위가 혼인의 본질인 부부 공동생활을 침해하거나 그 유지를 방해하는 경우에는 위자료 청구가 인정됩니다."
주민등록 전입신고 후 혼인신고의 법적 의미는 무엇인가요?,"혼인신고는 법적인 결혼관계를 성립시키는 행위이며, 주민등록 전입신고와 함께 이루어질 경우 이는 법적으로 이혼 및 재혼 여부를 명확히 하는 데에 중요한 역할을 합니다. 특히, 민법 제801조에 따르면 혼인의 성립은 신고를 함으로써 이루어지므로, 보고서에 기재된 주소가 동일하다는 점은 법적으로 유효한 결혼관계를 증명하는 데 필수적입니다.",주민등록 전입 신고 혼인신고 법적 의미,1,2,2021-05-12T09:00:00.000+09:00,"주민등록 전입신고 후 혼인신고의 법적 의미는 무엇인가요? 혼인신고는 법적인 결혼관계를 성립시키는 행위이며, 주민등록 전입신고와 함께 이루어질 경우 이는 법적으로 이혼 및 재혼 여부를 명확히 하는 데에 중요한 역할을 합니다. 특히, 민법 제801조에 따르면 혼인의 성립은 신고를 함으로써 이루어지므로, 보고서에 기재된 주소가 동일하다는 점은 법적으로 유효한 결혼관계를 증명하는 데 필수적입니다."
"혼인관계의 파탄을 주장하는 경우, 이혼 사유로 인정되기 위해 필요한 조건은 무엇인가요?","민법 제840조에 따르면, 혼인을 계속하기 어려운 중대한 사유가 있을 때 이혼 사유로 인정됩니다. 혼인관계가 파탄된 경우, 부부 간의 애정과 신뢰가 더 이상 회복할 수 없는 상태에 이르렀음을 입증해야 합니다. 이에 따라 부부가 실질적으로 장기간 별거하며, 그로 인해 부부공동생활이 파탄되었음을 객관적으로 증명할 수 있어야 합니다.",혼인 관계 파탄 이혼 사유,1,4,2023-02-14T09:00:00.000+09:00,"혼인관계의 파탄을 주장하는 경우, 이혼 사유로 인정되기 위해 필요한 조건은 무엇인가요? 민법 제840조에 따르면, 혼인을 계속하기 어려운 중대한 사유가 있을 때 이혼 사유로 인정됩니다. 혼인관계가 파탄된 경우, 부부 간의 애정과 신뢰가 더 이상 회복할 수 없는 상태에 이르렀음을 입증해야 합니다. 이에 따라 부부가 실질적으로 장기간 별거하며, 그로 인해 부부공동생활이 파탄되었음을 객관적으로 증명할 수 있어야 합니다."
배우자가 불법행위자로부터 위자료를 받을 수 있는 근거는 무엇인가요?,"불법행위로 인해 부부공동생활이 침해되고 배우자가 정신적 고통을 겪은 경우, 민법 제751조에 따라 위자료를 받을 수 있습니다. 이는 상대방이 고의로 부정행위를 지속하며 법률상 혼인 관계에 있는 부부의 공동생활을 방해한 경우 불법행위로 인정되기 때문입니다.",배우자 불법행위 자로 위자료 받다,1,6,2018-10-18T09:00:00.000+09:00,"배우자가 불법행위자로부터 위자료를 받을 수 있는 근거는 무엇인가요? 불법행위로 인해 부부공동생활이 침해되고 배우자가 정신적 고통을 겪은 경우, 민법 제751조에 따라 위자료를 받을 수 있습니다. 이는 상대방이 고의로 부정행위를 지속하며 법률상 혼인 관계에 있는 부부의 공동생활을 방해한 경우 불법행위로 인정되기 때문입니다."
부정행위로 인한 손해배상 청구에서 위자료 액수는 어떻게 결정되나요?,"위자료 액수는 혼인기간, 가족관계, 부정행위의 경위 및 내용, 부정행위 기간, 현재의 배우자 관계 등 다양한 제반 사정을 종합하여 판단합니다. 법원은 변론 전체의 취지를 고려하여 합리적인 액수를 결정합니다.",부정행위 손해배상 청구 위자료 액수 결정,1,6,2018-11-13T09:00:00.000+09:00,"부정행위로 인한 손해배상 청구에서 위자료 액수는 어떻게 결정되나요? 위자료 액수는 혼인기간, 가족관계, 부정행위의 경위 및 내용, 부정행위 기간, 현재의 배우자 관계 등 다양한 제반 사정을 종합하여 판단합니다. 법원은 변론 전체의 취지를 고려하여 합리적인 액수를 결정합니다."
명확히 존재하는 이혼사유와 각종 송금의 의미는 어떻게 해석되나요?,"이혼 이후의 송금행위는 일반적으로 명의신탁약정의 해지 의사를 표현하는 것으로 해석될 수 있습니다. 즉, 관련 법리인 민법 제111조에 근거하여 이혼문제가 발생한 경우, 상대방에게 송금되었던 금전의 반환을 청구할 수 있으며, 이는 부당이득 반환 청구의 기초가 됩니다.",존재 이혼 사유 각종 송금 의미 해석,1,1,2022-11-11T09:00:00.000+09:00,"명확히 존재하는 이혼사유와 각종 송금의 의미는 어떻게 해석되나요? 이혼 이후의 송금행위는 일반적으로 명의신탁약정의 해지 의사를 표현하는 것으로 해석될 수 있습니다. 즉, 관련 법리인 민법 제111조에 근거하여 이혼문제가 발생한 경우, 상대방에게 송금되었던 금전의 반환을 청구할 수 있으며, 이는 부당이득 반환 청구의 기초가 됩니다."
부정행위에 대한 위자료의 산정 기준은 무엇인가요?,"부정행위로 인한 위자료는 전형적으로 부부의 혼인기간, 가족관계, 부정행위의 내용과 정도를 고려하여 산정됩니다. 특히 대법원 1988. 5. 24. 선고 88므7 판결 및 1992. 11. 10. 선고 92므68 판결에 따르면, 위자료의 액수는 손해의 정도와 피해자가 입은 정신적 고통을 기초로 하여 결정되어야 합니다.",부정행위 위자료 산정 기준,1,3,2022-05-25T09:00:00.000+09:00,"부정행위에 대한 위자료의 산정 기준은 무엇인가요? 부정행위로 인한 위자료는 전형적으로 부부의 혼인기간, 가족관계, 부정행위의 내용과 정도를 고려하여 산정됩니다. 특히 대법원 1988. 5. 24. 선고 88므7 판결 및 1992. 11. 10. 선고 92므68 판결에 따르면, 위자료의 액수는 손해의 정도와 피해자가 입은 정신적 고통을 기초로 하여 결정되어야 합니다."
부부의 부정행위로 인한 손해배상청구에서 요구되는 조건은 무엇인가요?,"민법 제840조에 따르면, 부부의 일방이 부정행위를 한 경우에는 재판상 이혼사유가 발생하며, 이로 인해 정신적 고통을 입은 배우자는 불법행위에 따른 손해배상청구권을 가지게 됩니다. 따라서 손해배상을 청구하기 위해서는 부정행위의 존재 및 그로 인해 발생한 정신적 고통을 입증해야 하며, 이때 부정행위에 해당하는 행위는 간통을 포함하여 부부의 정조의무를 위반하는 모든 행위를 포함합니다.",부부 부정행위 손해배상 청구 요구,1,6,2017-11-29T09:00:00.000+09:00,"부부의 부정행위로 인한 손해배상청구에서 요구되는 조건은 무엇인가요? 민법 제840조에 따르면, 부부의 일방이 부정행위를 한 경우에는 재판상 이혼사유가 발생하며, 이로 인해 정신적 고통을 입은 배우자는 불법행위에 따른 손해배상청구권을 가지게 됩니다. 따라서 손해배상을 청구하기 위해서는 부정행위의 존재 및 그로 인해 발생한 정신적 고통을 입증해야 하며, 이때 부정행위에 해당하는 행위는 간통을 포함하여 부부의 정조의무를 위반하는 모든 행위를 포함합니다."
부부의 성적 성실의무 위반으로 인한 위자료 청구의 인정 요건은 무엇인가요?,"부부의 성적 성실의무 위반으로 인한 위자료 청구는 민법에서 부부가 서로 부정행위를 하지 않을 의무를 명시하고 있는 점을 근거로 합니다. 부정행위가 인정되는 경우, 피해 배우자는 상대방의 부정행위로 인해 입은 사실과 그에 따른 정신적 고통을 입증하여야 하며, 손해액 산정 시 부정행위의 기간 및 정도를 기준으로 평가됩니다.",부부 성적 성실 의무 위반 위자료 청구,1,1,2020-09-25T09:00:00.000+09:00,"부부의 성적 성실의무 위반으로 인한 위자료 청구의 인정 요건은 무엇인가요? 부부의 성적 성실의무 위반으로 인한 위자료 청구는 민법에서 부부가 서로 부정행위를 하지 않을 의무를 명시하고 있는 점을 근거로 합니다. 부정행위가 인정되는 경우, 피해 배우자는 상대방의 부정행위로 인해 입은 사실과 그에 따른 정신적 고통을 입증하여야 하며, 손해액 산정 시 부정행위의 기간 및 정도를 기준으로 평가됩니다."
피해자가 겪은 정신적 고통에 대한 손해배상 청구는 어떤 법리로 인정됩니까?,"피해자가 부정행위로 인해 정신적 고통을 받은 경우, 이는 불법행위에 해당하여 손해배상 청구가 가능합니다. 대법원 판례에 따르면, 제3자는 혼인의 본질을 침해하여 부부 공동생활을 방해할 경우 배우자에게 정신적 고통을 가하는 행위로 법적 책임을 질 수 있습니다. 따라서 이런 경우에는 위자료의 지급 의무가 인정됩니다.",피해자 겪다 정신 고통 손해배상 청구 법리,1,6,2023-06-27T09:00:00.000+09:00,"피해자가 겪은 정신적 고통에 대한 손해배상 청구는 어떤 법리로 인정됩니까? 피해자가 부정행위로 인해 정신적 고통을 받은 경우, 이는 불법행위에 해당하여 손해배상 청구가 가능합니다. 대법원 판례에 따르면, 제3자는 혼인의 본질을 침해하여 부부 공동생활을 방해할 경우 배우자에게 정신적 고통을 가하는 행위로 법적 책임을 질 수 있습니다. 따라서 이런 경우에는 위자료의 지급 의무가 인정됩니다."
부정행위에 따른 위자료 청구에서 인정되는 조건은 무엇인가요?,"민법 제840조 제1호에 따르면, 부정행위를 통한 위자료 청구는 간통뿐만 아니라 부부의 정조의무에 충실하지 않는 일체의 부정한 행위를 포함합니다. 따라서, 제3자가 한 배우자의 부정행위가 부부의 공동생활을 침해하고 배우자의 권리를 침해하여 정신적 고통을 유발한 경우, 이러한 사실이 인정되면 위자료 청구가 가능하다고 볼 수 있습니다.",부정행위 위자료 청구,1,6,2021-01-27T09:00:00.000+09:00,"부정행위에 따른 위자료 청구에서 인정되는 조건은 무엇인가요? 민법 제840조 제1호에 따르면, 부정행위를 통한 위자료 청구는 간통뿐만 아니라 부부의 정조의무에 충실하지 않는 일체의 부정한 행위를 포함합니다. 따라서, 제3자가 한 배우자의 부정행위가 부부의 공동생활을 침해하고 배우자의 권리를 침해하여 정신적 고통을 유발한 경우, 이러한 사실이 인정되면 위자료 청구가 가능하다고 볼 수 있습니다."
손해배상청구소송에서 정신적 손해에 대한 위자료를 받을 수 있는 인정범위는 어떻게 되나요?,"정신적 손해에 대한 위자료는 손해의 양과 질, 행위의 고의성과 중점 정도, 피해자의 나이 및 성격, 가해자의 행위 동기와 태도 등의 요소를 종합적으로 고려하여 결정됩니다. 예를 들어 부모가 자녀와의 면접교섭권을 침해당하여 겪은 정신적 고통은 경험칙상 명백하고, 이에 따른 위자료가 지급될 수 있습니다.",손해배상 청구 소송 정신 손해 위자료 받다 범위,1,6,2023-01-31T09:00:00.000+09:00,"손해배상청구소송에서 정신적 손해에 대한 위자료를 받을 수 있는 인정범위는 어떻게 되나요? 정신적 손해에 대한 위자료는 손해의 양과 질, 행위의 고의성과 중점 정도, 피해자의 나이 및 성격, 가해자의 행위 동기와 태도 등의 요소를 종합적으로 고려하여 결정됩니다. 예를 들어 부모가 자녀와의 면접교섭권을 침해당하여 겪은 정신적 고통은 경험칙상 명백하고, 이에 따른 위자료가 지급될 수 있습니다."
배우자의 부정행위로 인해 발생한 위자료 액수를 산정하는 기준은 무엇인가요?,"위자료 액수는 혼인기간, 자녀 관계, 부정행위의 정도와 기간 등 여러 사정을 참작하여 결정됩니다. 위자료의 금액은 행위로 인해 배우자가 겪은 정신적 고통의 정도를 기준으로 산정됩니다. 예를 들어, 부정행위의 기간, 부정행위로 인한 결혼생활의 파탄 여부 등을 종합적으로 고려하여 위자료 금액을 책정하게 됩니다.",배우자 부정행위 위자료 액수 산정 기준,1,3,2022-04-26T09:00:00.000+09:00,"배우자의 부정행위로 인해 발생한 위자료 액수를 산정하는 기준은 무엇인가요? 위자료 액수는 혼인기간, 자녀 관계, 부정행위의 정도와 기간 등 여러 사정을 참작하여 결정됩니다. 위자료의 금액은 행위로 인해 배우자가 겪은 정신적 고통의 정도를 기준으로 산정됩니다. 예를 들어, 부정행위의 기간, 부정행위로 인한 결혼생활의 파탄 여부 등을 종합적으로 고려하여 위자료 금액을 책정하게 됩니다."
재산분할합의서에서의 채무에 대한 규정은 어떤 법적 효력을 가질까요?,"재산분할합의서에서 각 당사자는 공동재산과 관련된 채무 분담을 명시할 수 있습니다. 일반적으로, 합의서의 내용은 당사자 간의 법적 구속력을 가지며, 합의된 사항을 이행하지 않을 경우 법적 제재를 받게 될 수도 있습니다. 따라서, 합의서에 채무 이행과 관련된 구체적인 내용이 포함되어 있다면 이는 관련 법리에 의거하여 법적 효력을 발휘하게 됩니다.",재산 분할 합 서다 채무 규정 법적 가지다,1,1,2020-12-11T09:00:00.000+09:00,"재산분할합의서에서의 채무에 대한 규정은 어떤 법적 효력을 가질까요? 재산분할합의서에서 각 당사자는 공동재산과 관련된 채무 분담을 명시할 수 있습니다. 일반적으로, 합의서의 내용은 당사자 간의 법적 구속력을 가지며, 합의된 사항을 이행하지 않을 경우 법적 제재를 받게 될 수도 있습니다. 따라서, 합의서에 채무 이행과 관련된 구체적인 내용이 포함되어 있다면 이는 관련 법리에 의거하여 법적 효력을 발휘하게 됩니다."
재산분할 청구에서 양도양수 계약에 따른 채권의 인정 범위는 어떻게 되나요?,"재산분할 청구에서 양도양수 계약에 따른 채권의 인정 범위는 채권의 특정성이 중요합니다. 대법원 판례에 의하면 양도된 채권은 제3자가 그 채권의 존재와 내용에 대해 알 수 있도록 명확히 특정되어야 하며, 그렇지 않으면 양도는 유효하지 않다고 판시하고 있습니다(대법원 2013. 3. 14. 선고 2011다28946 판결 참조). 즉, 양도된 채권의 종류, 금액 등 구체적인 사항이 불명확할 경우 채권 양도가 인정되지 않을 수 있습니다.",재산 분할 청구 양도 양수 계약 채권 범위,1,8,2022-04-21T09:00:00.000+09:00,"재산분할 청구에서 양도양수 계약에 따른 채권의 인정 범위는 어떻게 되나요? 재산분할 청구에서 양도양수 계약에 따른 채권의 인정 범위는 채권의 특정성이 중요합니다. 대법원 판례에 의하면 양도된 채권은 제3자가 그 채권의 존재와 내용에 대해 알 수 있도록 명확히 특정되어야 하며, 그렇지 않으면 양도는 유효하지 않다고 판시하고 있습니다(대법원 2013. 3. 14. 선고 2011다28946 판결 참조). 즉, 양도된 채권의 종류, 금액 등 구체적인 사항이 불명확할 경우 채권 양도가 인정되지 않을 수 있습니다."
손해배상액 결정 시 고려해야 할 요소는 무엇인가요?,"손해배상액을 결정할 때에는 부부의 혼인기간 및 가족관계, 부정행위의 내용과 정도, 부정행위가 부부 공동생활에 미친 영향, 그리고 사건 전후의 경위 등을 종합적으로 고려해야 합니다. 이러한 요소들은 정신적 고통에 대한 위자료의 적정성을 판단하는 기준이 됩니다.",손해배상 결정 고려 요소,1,6,2020-09-11T09:00:00.000+09:00,"손해배상액 결정 시 고려해야 할 요소는 무엇인가요? 손해배상액을 결정할 때에는 부부의 혼인기간 및 가족관계, 부정행위의 내용과 정도, 부정행위가 부부 공동생활에 미친 영향, 그리고 사건 전후의 경위 등을 종합적으로 고려해야 합니다. 이러한 요소들은 정신적 고통에 대한 위자료의 적정성을 판단하는 기준이 됩니다."
배우자가 있음에도 부적절한 관계를 유지한 제3자에 대해 어떤 법적 책임이 부과되나요?,"제3자가 부부의 일방과 부정행위를 함으로써 혼인의 본질에 해당하는 부부공동생활을 침해하거나 그 유지를 방해하고 그에 대한 배우자로서의 권리를 침해하면 불법행위를 구성합니다. 이는 배우자에게 정신적 고통을 가하는 행위로 인정되며, 이에 대해 위자료를 지급할 의무가 있습니다. 이때의 '부정행위'는 간통을 포함하는 보다 넓은 개념으로, 간통에까지 이르지 않더라도 부부의 정조의무에 충실하지 않는 일체의 부정한 행위가 포함됩니다.",배우자 관계 유지 대해 법적 책임 부 제3자에,1,0,2021-11-09T09:00:00.000+09:00,"배우자가 있음에도 부적절한 관계를 유지한 제3자에 대해 어떤 법적 책임이 부과되나요? 제3자가 부부의 일방과 부정행위를 함으로써 혼인의 본질에 해당하는 부부공동생활을 침해하거나 그 유지를 방해하고 그에 대한 배우자로서의 권리를 침해하면 불법행위를 구성합니다. 이는 배우자에게 정신적 고통을 가하는 행위로 인정되며, 이에 대해 위자료를 지급할 의무가 있습니다. 이때의 '부정행위'는 간통을 포함하는 보다 넓은 개념으로, 간통에까지 이르지 않더라도 부부의 정조의무에 충실하지 않는 일체의 부정한 행위가 포함됩니다."
사실혼 관계에서 생활공동체를 유지하면서 취득한 재산은 누가 소유하나요?,"사실혼 관계의 쌍방이 재산의 대가를 공동으로 부담했다면, 그 재산은 쌍방의 공유로 볼 수 있습니다. 이는 민법 제830조에 근거하며, 관련 판례(93다52068 등)를 통해 특유재산 추정이 번복되어 공유재산으로 추정될 수 있습니다.",사실혼 관계 생활 공동체 유지 취득 재산 누 소유 하나요,1,3,2022-05-20T09:00:00.000+09:00,"사실혼 관계에서 생활공동체를 유지하면서 취득한 재산은 누가 소유하나요? 사실혼 관계의 쌍방이 재산의 대가를 공동으로 부담했다면, 그 재산은 쌍방의 공유로 볼 수 있습니다. 이는 민법 제830조에 근거하며, 관련 판례(93다52068 등)를 통해 특유재산 추정이 번복되어 공유재산으로 추정될 수 있습니다."
"배우자가 부정행위를 했을 때, 가해자의 변명이나 주장에 대한 법적 인식은 어떻게 이루어지나요?","배우자가 부정행위를 했을 때, 가해자가 부정행위 시점에서 피해자의 혼인 사실을 몰랐다고 주장하더라도, 부정행위 자체가 불법행위를 구성하므로 손해배상의 의무가 있습니다. 또한, 배우자의 자살 등의 추가 피해가 부정행위로 인해 발생한 경우, 가해자의 주장이 정당하지 않거나 증거가 부족할 경우 그 주장은 받아들여지지 않습니다. 예를 들어, 망인이 부정행위에 대한 죄책감으로 자살한 경우, 가해자의 책임을 면할 수 있는 증거가 없다면 정신적 고통에 대한 위자료를 지급해야 합니다.",배우자 부정행위 가해자 변명 법적 인식 이루어지다,1,5,2014-01-16T09:00:00.000+09:00,"배우자가 부정행위를 했을 때, 가해자의 변명이나 주장에 대한 법적 인식은 어떻게 이루어지나요? 배우자가 부정행위를 했을 때, 가해자가 부정행위 시점에서 피해자의 혼인 사실을 몰랐다고 주장하더라도, 부정행위 자체가 불법행위를 구성하므로 손해배상의 의무가 있습니다. 또한, 배우자의 자살 등의 추가 피해가 부정행위로 인해 발생한 경우, 가해자의 주장이 정당하지 않거나 증거가 부족할 경우 그 주장은 받아들여지지 않습니다. 예를 들어, 망인이 부정행위에 대한 죄책감으로 자살한 경우, 가해자의 책임을 면할 수 있는 증거가 없다면 정신적 고통에 대한 위자료를 지급해야 합니다."
면접교섭권 침해에 대한 위자료 청구 시 필요한 증거는 무엇인가요?,"면접교섭권 침해에 대한 위자료 청구를 위해 피해자는 면접교섭의 구체적인 일정과 그 침해의 사실을 입증할 수 있는 증거를 제시해야 하며, 이를 통해 민법 제750조에 근거한 불법행위를 입증할 수 있어야 합니다. 이는 면접교섭이 이루어지지 않거나 방해받았음을 보여줄 수 있는 실제 사례와 정황을 포함합니다.",면접교섭권 침해 위자료 청구 증거,1,6,2021-05-11T09:00:00.000+09:00,"면접교섭권 침해에 대한 위자료 청구 시 필요한 증거는 무엇인가요? 면접교섭권 침해에 대한 위자료 청구를 위해 피해자는 면접교섭의 구체적인 일정과 그 침해의 사실을 입증할 수 있는 증거를 제시해야 하며, 이를 통해 민법 제750조에 근거한 불법행위를 입증할 수 있어야 합니다. 이는 면접교섭이 이루어지지 않거나 방해받았음을 보여줄 수 있는 실제 사례와 정황을 포함합니다."
정신적 손해에 대한 금전배상의 결정 기준은 무엇인가요?,"정신적 손해에 대한 금전배상의 결정 기준은 피해자의 정신적 고통의 정도와 부정행위의 태양, 그 행위가 혼인관계 파탄에 미친 영향 등을 종합적으로 고려하여 금액을 정하는 것입니다. 대법원 판례에 따르면, 이러한 요소들은 손해배상액을 정할 때 중요한 판단 근거로 작용하며, 사안의 특수성에 따라 적절하게 평가되어야 합니다.",정신 손해 금전 배상 결정 기준,1,8,2021-06-16T09:00:00.000+09:00,"정신적 손해에 대한 금전배상의 결정 기준은 무엇인가요? 정신적 손해에 대한 금전배상의 결정 기준은 피해자의 정신적 고통의 정도와 부정행위의 태양, 그 행위가 혼인관계 파탄에 미친 영향 등을 종합적으로 고려하여 금액을 정하는 것입니다. 대법원 판례에 따르면, 이러한 요소들은 손해배상액을 정할 때 중요한 판단 근거로 작용하며, 사안의 특수성에 따라 적절하게 평가되어야 합니다."
