input,output,input_processed,is_divorce,topic_label,announce_date,text_combined
부정행위로 인한 정신적 고통에 대한 손해배상 책임의 인정 기준은 무엇인가요?,"부정행위로 인해 정신적 고통을 입은 경우, 원칙적으로 불법행위가 성립합니다. 이는 제760조에 의거하여 제3자가 부부 중 한 쪽의 부정행위로 인해 부부공동생활을 침해하거나 그 유지를 방해하여 정신적 고통을 초래한 경우에 해당합니다. 이러한 경우, 피해자는 고통에 대한 손해배상을 청구할 수 있으며, 그 액수는 피해자의 상황, 부정행위의 기간 및 정도, 그리고 피해자의 정신적 상태를 종합적으로 고려하여 결정됩니다.",부정행위 정신 고통 손해배상 책임 기준,1,5,2019-07-24T09:00:00.000+09:00,"부정행위에 대한 손해배상 소송에서 손해액의 산정 기준은 무엇인가요? 부정행위로 인한 손해액은 부부공동생활이 파탄된 정도, 정신적 고통의 크기, 부정행위의 기간 및 그 심각성 등을 종합적으로 고려하여 산정됩니다. 대법원 2015. 5. 29. 선고에서는 부정행위가 입증된 경우, 부부의 신분상 및 생활상의 일체성을 존중하여 손해액을 평가할 때, 관련된 모든 정황을 종합적으로 고려해야 한다고 하였습니다."
간통에 이르지 않은 부정한 행위도 불법행위로 인정될 수 있나요?,"대법원 판례에 따르면, 간통에 이르지 않은 부정한 행위도 불법행위로 인정될 수 있습니다. '부정행위'는 간통을 포함하여 부부의 정조의무에 충실하지 않는 일체의 부정한 행위가 포함되므로, 부정한 행위인지 여부는 구체적인 사안에 따라 그 정도와 상황을 참작하여 평가될 수 있습니다. 따라서 간통이 아니더라도 부정행위로 인정될 수 있습니다.",간통 이르다 부정 행위 불법행위,1,7,2023-07-14T09:00:00.000+09:00,"부정행위로 인한 정신적 고통에 대한 손해배상 책임의 인정 기준은 무엇인가요? 부정행위로 인해 정신적 고통을 입은 경우, 원칙적으로 불법행위가 성립합니다. 이는 제760조에 의거하여 제3자가 부부 중 한 쪽의 부정행위로 인해 부부공동생활을 침해하거나 그 유지를 방해하여 정신적 고통을 초래한 경우에 해당합니다. 이러한 경우, 피해자는 고통에 대한 손해배상을 청구할 수 있으며, 그 액수는 피해자의 상황, 부정행위의 기간 및 정도, 그리고 피해자의 정신적 상태를 종합적으로 고려하여 결정됩니다."
"배우자가 제3자와 부정행위를 한 경우, 정신적 고통에 대한 손해배상을 청구할 수 있는 법적 근거는 무엇인가요?","배우자가 제3자와 부정행위를 하여 혼인관계를 침해하거나 유지에 방해를 초래하여 배우자에게 정신적 고통을 가한 경우, 이는 민법상 불법행위에 해당합니다. 이에 따라 피해 배우자는 민법 제750조에 따라 손해배상을 청구할 수 있습니다. 불법행위가 인정되기 위해서는 제3자의 부정행위가 혼인관계에 실질적인 손상을 주었고, 그로 인해 정신적 고통을 입었다는 사실을 입증해야 합니다.",배우자 부정행위 정신 고통 손해배상 청구 법적 제3자와,1,6,2016-11-24T09:00:00.000+09:00,"간통에 이르지 않은 부정한 행위도 불법행위로 인정될 수 있나요? 대법원 판례에 따르면, 간통에 이르지 않은 부정한 행위도 불법행위로 인정될 수 있습니다. '부정행위'는 간통을 포함하여 부부의 정조의무에 충실하지 않는 일체의 부정한 행위가 포함되므로, 부정한 행위인지 여부는 구체적인 사안에 따라 그 정도와 상황을 참작하여 평가될 수 있습니다. 따라서 간통이 아니더라도 부정행위로 인정될 수 있습니다."
부부 간 임대차계약에서 임대차보증금 반환채권의 소유 여부를 입증하기 위한 조건은 무엇인가요?,"민법 제830조 제1항에 따르면, 부부의 일방이 혼인 중 단독 명의로 취득한 부동산은 그 명의자의 특유재산으로 추정됩니다. 따라서 상대방이 그 특유재산의 대가를 부담하여 그 소유권을 주장하고자 한다면, 실제로 그 부동산의 대가를 부담하였음을 증명해야 하며 단순히 자금의 출처만으로는 특별한 사정이 없는 한 명의신탁이 있었다고 볼 수 없습니다. 즉, 부부 간에 계약이 체결되었다면, 그 계약의 조건 및 내용을 종합적으로 고려하여야 하며, 구체적인 입증이 필요합니다.",부부 임대차 계약 임대차보증금 반환 채권 소유 여부 입증,1,8,2015-04-09T09:00:00.000+09:00,"배우자가 제3자와 부정행위를 한 경우, 정신적 고통에 대한 손해배상을 청구할 수 있는 법적 근거는 무엇인가요? 배우자가 제3자와 부정행위를 하여 혼인관계를 침해하거나 유지에 방해를 초래하여 배우자에게 정신적 고통을 가한 경우, 이는 민법상 불법행위에 해당합니다. 이에 따라 피해 배우자는 민법 제750조에 따라 손해배상을 청구할 수 있습니다. 불법행위가 인정되기 위해서는 제3자의 부정행위가 혼인관계에 실질적인 손상을 주었고, 그로 인해 정신적 고통을 입었다는 사실을 입증해야 합니다."
부정한 행위의 범위와 그 평가 기준은 무엇인가요?,민법 제840조 제1호의 배우자의 부정한 행위는 간통을 포함하여 간통에 이르지 않아도 부부의 정조의무에 충실하지 않은 일체의 행위를 포함하는 보다 넓은 개념입니다. 부정한 행위인지 여부는 각 구체적 사안에 따라 그 정도와 상황을 참작하여 평가해야 합니다. (대법원 2013. 11. 28. 선고 2010므4095 판결 참조),부정 행위 범위 평 기준,1,7,2020-11-04T09:00:00.000+09:00,"부부 간 임대차계약에서 임대차보증금 반환채권의 소유 여부를 입증하기 위한 조건은 무엇인가요? 민법 제830조 제1항에 따르면, 부부의 일방이 혼인 중 단독 명의로 취득한 부동산은 그 명의자의 특유재산으로 추정됩니다. 따라서 상대방이 그 특유재산의 대가를 부담하여 그 소유권을 주장하고자 한다면, 실제로 그 부동산의 대가를 부담하였음을 증명해야 하며 단순히 자금의 출처만으로는 특별한 사정이 없는 한 명의신탁이 있었다고 볼 수 없습니다. 즉, 부부 간에 계약이 체결되었다면, 그 계약의 조건 및 내용을 종합적으로 고려하여야 하며, 구체적인 입증이 필요합니다."
부정행위에 대한 손해배상책임이 성립하기 위한 조건은 무엇인가요?,부정행위에 대한 손해배상책임이 성립하기 위해서는 제3자가 혼인관계의 일방에게 부정행위를 하여 부부의 공동생활을 침해하거나 유지에 방해가 되었음을 입증해야 합니다. 이는 대법원 2014. 11. 20. 선고 2011므2997 전원합의체 판결에서 언급된 바와 같이 간통에 해당하지 않더라도 부부의 정조의무에 충실하지 않은 일체의 부정한 행위가 포함됩니다.,부정행위 손해배상 책임,1,5,2022-11-10T09:00:00.000+09:00,부정한 행위의 범위와 그 평가 기준은 무엇인가요? 민법 제840조 제1호의 배우자의 부정한 행위는 간통을 포함하여 간통에 이르지 않아도 부부의 정조의무에 충실하지 않은 일체의 행위를 포함하는 보다 넓은 개념입니다. 부정한 행위인지 여부는 각 구체적 사안에 따라 그 정도와 상황을 참작하여 평가해야 합니다. (대법원 2013. 11. 28. 선고 2010므4095 판결 참조)
부정한 행위의 인정 기준은 무엇인가요?,"부정한 행위는 배우자로서의 정조의무를 위반하는 모든 행위를 포함하며, 개별 사례에 따라 행위의 정도와 상황을 반영하여 평가되어야 합니다. 이와 관련하여 대법원은 부정한 행위의 범위가 간통보다 넓다고 보았으며, 따라서 특정 상황의 구체적 요소를 검토하여 결론에 도달합니다.",부정 행위 기준,1,3,2018-06-21T09:00:00.000+09:00,부정행위에 대한 손해배상책임이 성립하기 위한 조건은 무엇인가요? 부정행위에 대한 손해배상책임이 성립하기 위해서는 제3자가 혼인관계의 일방에게 부정행위를 하여 부부의 공동생활을 침해하거나 유지에 방해가 되었음을 입증해야 합니다. 이는 대법원 2014. 11. 20. 선고 2011므2997 전원합의체 판결에서 언급된 바와 같이 간통에 해당하지 않더라도 부부의 정조의무에 충실하지 않은 일체의 부정한 행위가 포함됩니다.
부정행위로 인한 정신적 고통에 대한 배상청구의 인정 범위는 어떻게 될까요?,"제3자가 부부의 일방과 부정행위를 함으로써 부부 공동생활을 침해하거나 유지를 방해하는 경우, 피해자는 정신적 고통에 대한 배상을 청구할 수 있습니다. 대법원 2014. 11. 20. 선고 2011므2997 전원합의체 판결에 따르면, 부정행위는 간통을 포함하지 않더라도 정조의무에 충실하지 않는 부정한 행위로 인정될 수 있습니다. 이때 부정행위의 범위와 성격은 구체적인 사안에 따라 평가되어야 하며, 피해자가 입은 정신적 고통의 정도와 부정행위의 내용 및 기간 등을 종합적으로 고려하여 배상액이 결정됩니다.",부정행위 정신 고통 배상 청구 범위,1,6,2018-06-01T09:00:00.000+09:00,"부정한 행위의 인정 기준은 무엇인가요? 부정한 행위는 배우자로서의 정조의무를 위반하는 모든 행위를 포함하며, 개별 사례에 따라 행위의 정도와 상황을 반영하여 평가되어야 합니다. 이와 관련하여 대법원은 부정한 행위의 범위가 간통보다 넓다고 보았으며, 따라서 특정 상황의 구체적 요소를 검토하여 결론에 도달합니다."
부정행위의 존재를 입증하기 위한 법률적 요건은 무엇인가요?,"부정행위의 존재를 입증하기 위해서는 부부 사이에서의 신뢰와 의무가 침해되었음을 보여야 합니다. 이는 간통과 같은 명백한 부정행위 외에도, 배우자와의 부정한 관계를 형성하거나 유지한 행위를 포함하여 그 행위의 상황과 맥락에 따라 판단됩니다. 대법원 2013. 11. 28. 선고 2010므4095 판결에서도 각 사안의 구체적 상황에 따라 부정행위 여부가 평가되어야 한다고 명시하였습니다.",부정행위 존재 입증 법률,1,8,2016-03-04T09:00:00.000+09:00,"부정행위로 인한 정신적 고통에 대한 배상청구의 인정 범위는 어떻게 될까요? 제3자가 부부의 일방과 부정행위를 함으로써 부부 공동생활을 침해하거나 유지를 방해하는 경우, 피해자는 정신적 고통에 대한 배상을 청구할 수 있습니다. 대법원 2014. 11. 20. 선고 2011므2997 전원합의체 판결에 따르면, 부정행위는 간통을 포함하지 않더라도 정조의무에 충실하지 않는 부정한 행위로 인정될 수 있습니다. 이때 부정행위의 범위와 성격은 구체적인 사안에 따라 평가되어야 하며, 피해자가 입은 정신적 고통의 정도와 부정행위의 내용 및 기간 등을 종합적으로 고려하여 배상액이 결정됩니다."
"배우자의 부정행위로 인해 손해배상을 청구할 경우, 부정행위의 기준은 무엇인가요?","배우자의 부정행위는 간통을 포함하여 부부의 정조의무에 충실하지 않는 모든 행위를 의미합니다. 이는 구체적인 사안에 따라 그 정도와 상황을 참작하여 평가되어야 하며, 간통에 이르지 않더라도 부정한 행위로 간주될 수 있습니다.",배우자 부정행위 손해배상 청구 기준,1,6,2021-01-27T09:00:00.000+09:00,"부정행위의 존재를 입증하기 위한 법률적 요건은 무엇인가요? 부정행위의 존재를 입증하기 위해서는 부부 사이에서의 신뢰와 의무가 침해되었음을 보여야 합니다. 이는 간통과 같은 명백한 부정행위 외에도, 배우자와의 부정한 관계를 형성하거나 유지한 행위를 포함하여 그 행위의 상황과 맥락에 따라 판단됩니다. 대법원 2013. 11. 28. 선고 2010므4095 판결에서도 각 사안의 구체적 상황에 따라 부정행위 여부가 평가되어야 한다고 명시하였습니다."
배우자의 부정행위로 인한 손해배상을 청구할 수 있는 경우는 무엇인가요?,"제3자가 부부의 일방과 부정행위를 함으로써 부부공동생활을 침해하거나 그 유지를 방해하여 배우자에게 정신적 고통을 가하는 행위는 불법행위를 구성합니다. 따라서 배우자의 부정행위로 인해 혼인관계가 파탄에 이르고 정신적 고통이 발생한 경우, 피해자인 배우자는 제3자에게 손해배상을 청구할 수 있습니다. 이는 대법원 판례(대법원 2015. 5. 29. 선고 2013므2441 판결)을 통해 확인할 수 있습니다.",배우자 부정행위 손해배상 청구,1,6,2015-09-16T09:00:00.000+09:00,"배우자의 부정행위로 인해 손해배상을 청구할 경우, 부정행위의 기준은 무엇인가요? 배우자의 부정행위는 간통을 포함하여 부부의 정조의무에 충실하지 않는 모든 행위를 의미합니다. 이는 구체적인 사안에 따라 그 정도와 상황을 참작하여 평가되어야 하며, 간통에 이르지 않더라도 부정한 행위로 간주될 수 있습니다."
상속자가 상속세를 공동으로 납부할 경우 각자의 납부 의무는 어떻게 결정되나요?,"구 상속세 및 증여세법 제3조 제3항에 따르면, 상속세는 각 상속인이 자신이 받은 재산에 한하여 연대하여 납부할 의무를 집니다. 따라서 상속세는 각 상속인의 상속분에 따라 비례적으로 납부해야 하며, 상속세를 잔여적으로 및 상속인의 실제 상속지분에 따라 부담해야 합니다. 법정상속분에 따라 납부하지 않은 비율은 법정상속분에 기초하여 판단해야 하며, 기여분에 대한 상속세 부담은 기여분에 따라 이루어지지 않고 법정상속분에 따라 납부해야 함이 원칙입니다.",상속 상속세 공동 납부 각자 의무 결정,1,4,2018-11-09T09:00:00.000+09:00,"배우자의 부정행위로 인한 손해배상을 청구할 수 있는 경우는 무엇인가요? 제3자가 부부의 일방과 부정행위를 함으로써 부부공동생활을 침해하거나 그 유지를 방해하여 배우자에게 정신적 고통을 가하는 행위는 불법행위를 구성합니다. 따라서 배우자의 부정행위로 인해 혼인관계가 파탄에 이르고 정신적 고통이 발생한 경우, 피해자인 배우자는 제3자에게 손해배상을 청구할 수 있습니다. 이는 대법원 판례(대법원 2015. 5. 29. 선고 2013므2441 판결)을 통해 확인할 수 있습니다."
배우자가 부정행위로 인해 입은 정신적 고통에 대한 손해배상을 요구할 때 고려해야 하는 법률적 기준은 무엇인가요?,"배우자는 제3자의 부정행위로 인해 정신적 고통을 겪었을 경우, 제3자에게 손해배상을 요구할 수 있습니다. 법원은 부부공동생활의 침해 여부, 부정행위의 인식 여부, 그리고 이에 따른 정신적 고통의 정도를 종합적으로 고려하여 손해배상액을 산정합니다. 법원은 제3자가 부정행위를 통해 혼인의 본질을 침해하고, 배우자의 권리를 침해했는지를 판단합니다. (대법원 2014. 11. 20. 선고 2011므2997 판결, 대법원 2005. 5. 13. 선고 2004다1899 판결 참조)",배우자 부정행위 입다 정신 고통 손해배상 요구 고려 법률 기준,1,6,2022-06-17T09:00:00.000+09:00,"상속자가 상속세를 공동으로 납부할 경우 각자의 납부 의무는 어떻게 결정되나요? 구 상속세 및 증여세법 제3조 제3항에 따르면, 상속세는 각 상속인이 자신이 받은 재산에 한하여 연대하여 납부할 의무를 집니다. 따라서 상속세는 각 상속인의 상속분에 따라 비례적으로 납부해야 하며, 상속세를 잔여적으로 및 상속인의 실제 상속지분에 따라 부담해야 합니다. 법정상속분에 따라 납부하지 않은 비율은 법정상속분에 기초하여 판단해야 하며, 기여분에 대한 상속세 부담은 기여분에 따라 이루어지지 않고 법정상속분에 따라 납부해야 함이 원칙입니다."
정신적 고통에 대한 손해배상의 기준은 어떻게 설정되나요?,"정신적 고통에 대한 손해배상액은 단순히 금전적 수치로 환산하기 어려운 요소가 많지만, 일반적으로 부정행위의 내역과 그로 인해 발생한 정신적 피해의 영향, 피해자의 생활 전반에 미친 영향을 포괄적으로 고려하여 설정됩니다. 대법원 판례에 의거하여 피해자의 개인적 상황 및 부부 공동 생활의 특성도 중요 요소로 평가됩니다.",정신 고통 손해배상 기준 설정,1,6,2020-12-10T09:00:00.000+09:00,"배우자가 부정행위로 인해 입은 정신적 고통에 대한 손해배상을 요구할 때 고려해야 하는 법률적 기준은 무엇인가요? 배우자는 제3자의 부정행위로 인해 정신적 고통을 겪었을 경우, 제3자에게 손해배상을 요구할 수 있습니다. 법원은 부부공동생활의 침해 여부, 부정행위의 인식 여부, 그리고 이에 따른 정신적 고통의 정도를 종합적으로 고려하여 손해배상액을 산정합니다. 법원은 제3자가 부정행위를 통해 혼인의 본질을 침해하고, 배우자의 권리를 침해했는지를 판단합니다. (대법원 2014. 11. 20. 선고 2011므2997 판결, 대법원 2005. 5. 13. 선고 2004다1899 판결 참조)"
"배우자의 부정행위로 인해 정신적 고통을 받은 경우, 손해배상을 받을 수 있는 법적 근거는 무엇인가요?","배우자의 부정행위로 인한 정신적 고통에 대해 손해배상을 받을 수 있는 법적 근거는 민법 제750조에서 정하고 있는 불법행위에 기초합니다. 부부 공동생활을 침해하는 행위로 인해 발생한 정신적 고통은 불법행위로 간주될 수 있으며, 가해자는 피해자에게 그에 대한 배상금을 지급할 의무가 있습니다.",배우자 부정행위 정신 고통 받다 손해배상 법적,1,6,2018-10-31T00:00:00.000+09:00,"정신적 고통에 대한 손해배상의 기준은 어떻게 설정되나요? 정신적 고통에 대한 손해배상액은 단순히 금전적 수치로 환산하기 어려운 요소가 많지만, 일반적으로 부정행위의 내역과 그로 인해 발생한 정신적 피해의 영향, 피해자의 생활 전반에 미친 영향을 포괄적으로 고려하여 설정됩니다. 대법원 판례에 의거하여 피해자의 개인적 상황 및 부부 공동 생활의 특성도 중요 요소로 평가됩니다."
부정행위로 인한 정신적 손해에 대한 손해배상 청구에서 인정할 수 있는 손해의 범위는 어떻게 되나요?,"부정행위에 의한 정신적 손해에 대한 손해배상 청구는 상대방의 불법행위로 인해 입은 정신적 고통을 포함합니다. 이에 따라 손해의 범위는 피해자가 겪은 정신적 고통의 정도, 부정행위의 경위, 횟수, 기간 등 다양한 사정을 고려하여 산정됩니다. 관련법리로는 대법원 2014. 11. 20. 선고 2011므2997 전원합의체 판결이 이에 대한 기준을 제시하였습니다.",부정행위 정신 손해 손해배상 청구 범위,1,6,2023-04-18T09:00:00.000+09:00,"배우자의 부정행위로 인해 정신적 고통을 받은 경우, 손해배상을 받을 수 있는 법적 근거는 무엇인가요? 배우자의 부정행위로 인한 정신적 고통에 대해 손해배상을 받을 수 있는 법적 근거는 민법 제750조에서 정하고 있는 불법행위에 기초합니다. 부부 공동생활을 침해하는 행위로 인해 발생한 정신적 고통은 불법행위로 간주될 수 있으며, 가해자는 피해자에게 그에 대한 배상금을 지급할 의무가 있습니다."
부정행위가 인정되기 위한 판별 기준은 무엇인가요?,"부정행위가 인정되기 위한 기준은 성관계 여부, 스킨쉽, 정서적 유대관계의 존재 등 여러 요소를 포함합니다. 대법원 판례에 따르면, 부정행위는 간통을 포함하는 개념으로, 구체적인 상황을 고려하여 평가해야 하며, 부부의 정조 의무를 위반하는 모든 행위가 포함될 수 있습니다. 특히, 성적 접촉 및 상호간의 애정 표현이 있는지를 중점적으로 고려합니다.",부정행위 판별 기준,1,3,2018-03-07T09:00:00.000+09:00,"부정행위로 인한 정신적 손해에 대한 손해배상 청구에서 인정할 수 있는 손해의 범위는 어떻게 되나요? 부정행위에 의한 정신적 손해에 대한 손해배상 청구는 상대방의 불법행위로 인해 입은 정신적 고통을 포함합니다. 이에 따라 손해의 범위는 피해자가 겪은 정신적 고통의 정도, 부정행위의 경위, 횟수, 기간 등 다양한 사정을 고려하여 산정됩니다. 관련법리로는 대법원 2014. 11. 20. 선고 2011므2997 전원합의체 판결이 이에 대한 기준을 제시하였습니다."
"피해자가 부정행위로 인한 손해배상을 청구할 때, 인정해야 할 정신적 고통의 범위는 어떻게 될까요?","부정행위로 인한 손해배상청구에서 피해자가 인정받을 수 있는 정신적 고통의 범위는, 혼인의 본질인 부부 공동생활의 침해와 유지의 방해에 대한 정신적 고통을 포함합니다. 대법원 판례에 의하면, 부정행위의 정도와 정황을 고려하여 피해자의 정신적 고통을 평가하며, 이를 통해 손해배상을 산정할 수 있는 법적 근거가 됩니다.",피해자 부정행위 손해배상 청구 정신 고통 범위,1,6,2019-10-01T09:00:00.000+09:00,"부정행위가 인정되기 위한 판별 기준은 무엇인가요? 부정행위가 인정되기 위한 기준은 성관계 여부, 스킨쉽, 정서적 유대관계의 존재 등 여러 요소를 포함합니다. 대법원 판례에 따르면, 부정행위는 간통을 포함하는 개념으로, 구체적인 상황을 고려하여 평가해야 하며, 부부의 정조 의무를 위반하는 모든 행위가 포함될 수 있습니다. 특히, 성적 접촉 및 상호간의 애정 표현이 있는지를 중점적으로 고려합니다."
부정행위에 연루된 대표이사가 책임을 줄이기 위한 법적 근거는 무엇인가요?,"민법 제760조 제3항에 따르면, 대표이사가 불법행위를 용이하게 한 정도의 주의의무를 해태한 경우, 과실에 의한 방조자로서의 공동불법행위 책임을 져야 할 가능성이 있습니다. 따라서, 자신이 그 행위를 방지해야 할 법적 의무를 다하지 않았다는 점이 반영될 수 있습니다.",부정행위 연루 대표이사 책임 줄이다 법적,1,5,2016-06-30T09:00:00.000+09:00,"피해자가 부정행위로 인한 손해배상을 청구할 때, 인정해야 할 정신적 고통의 범위는 어떻게 될까요? 부정행위로 인한 손해배상청구에서 피해자가 인정받을 수 있는 정신적 고통의 범위는, 혼인의 본질인 부부 공동생활의 침해와 유지의 방해에 대한 정신적 고통을 포함합니다. 대법원 판례에 의하면, 부정행위의 정도와 정황을 고려하여 피해자의 정신적 고통을 평가하며, 이를 통해 손해배상을 산정할 수 있는 법적 근거가 됩니다."
손해배상 청구에서 과실상계가 적용되는 경우는 어떤 경우인가요?,"손해배상 청구에서 과실상계는 피해자가 본인의 과실로 인해 손해를 확대한 경우에 적용됩니다. 민법 제398조에 따라, 피해자가 적절한 주의를 다하지 않았음이 입증되면, 손해배상의 의무가 그만큼 줄어들 수 있습니다. 예를 들어, 부정행위로 인한 손해배상 청구에서 피해자가 자신의 혼인관계를 소홀히 하고 그로 인해 손해가 확대되었다면, 법원은 피해자의 과실을 고려하여 손해배상액을 조정할 수 있습니다.",손해배상 청구 과실상계,1,6,2022-06-30T09:00:00.000+09:00,"부정행위에 연루된 대표이사가 책임을 줄이기 위한 법적 근거는 무엇인가요? 민법 제760조 제3항에 따르면, 대표이사가 불법행위를 용이하게 한 정도의 주의의무를 해태한 경우, 과실에 의한 방조자로서의 공동불법행위 책임을 져야 할 가능성이 있습니다. 따라서, 자신이 그 행위를 방지해야 할 법적 의무를 다하지 않았다는 점이 반영될 수 있습니다."
